{
  "$schema": "http://json-schema.org/draft-07/schema#",
  "$id": "https://mileage-flow-manager.app/llm-router.schema.json",
  "title": "LLM Router Config",
  "type": "object",
  "additionalProperties": false,
  "required": ["version", "aliases", "profiles", "categoryDefaults", "globalDefault", "routes"],
  "properties": {
    "version": { "type": "integer", "const": 1 },
    "aliases": {
      "type": "object",
      "minProperties": 1,
      "additionalProperties": { "type": "string", "minLength": 1 }
    },
    "profiles": {
      "type": "object",
      "minProperties": 1,
      "additionalProperties": {
        "type": "object",
        "additionalProperties": false,
        "required": ["primary", "fallbacks"],
        "properties": {
          "primary": { "type": "string", "minLength": 1 },
          "fallbacks": {
            "type": "array",
            "uniqueItems": true,
            "items": { "type": "string", "minLength": 1 }
          }
        }
      }
    },
    "categoryDefaults": {
      "type": "object",
      "additionalProperties": { "type": "string", "minLength": 1 }
    },
    "globalDefault": { "type": "string", "minLength": 1 },
    "routes": {
      "type": "array",
      "items": {
        "type": "object",
        "additionalProperties": false,
        "required": ["category", "capability", "profile"],
        "properties": {
          "category": { "type": "string" },
          "capability": { "type": "string" },
          "profile": { "type": "string", "minLength": 1 }
        }
      }
    }
  }
}
