{
  "version": 1,
  "aliases": {
    "efficient-primary": "opencode/deepseek-v4-flash-free",
    "efficient-fallback": "opencode/ling-3.0-flash-free",
    "coding-primary": "openai-codex/gpt-5.4-mini",
    "coding-fallback": "opencode/deepseek-v4-flash-free",
    "reasoning-primary": "openai-codex/gpt-5.6-luna",
    "reasoning-fallback": "opencode/deepseek-v4-flash-free",
    "review-primary": "openai-codex/gpt-5.6-luna",
    "review-fallback": "opencode/deepseek-v4-flash-free",
    "session-model": "opencode/deepseek-v4-flash-free",
    "baseten-primary": "baseten/zai-org/GLM-5.2"
  },
  "profiles": {
    "strong-reasoning": { "primary": "session-model", "fallbacks": [] },
    "coding": { "primary": "session-model", "fallbacks": [] },
    "efficient": { "primary": "session-model", "fallbacks": [] },
    "independent-review": { "primary": "session-model", "fallbacks": [] },
    "baseten": { "primary": "baseten-primary", "fallbacks": ["efficient-primary"] }
  },
  "categoryDefaults": {
    "feature": "coding",
    "bugfix": "strong-reasoning",
    "docs": "efficient",
    "refactor": "coding",
    "chore": "efficient"
  },
  "globalDefault": "efficient",
  "routes": [
    { "category": "feature", "capability": "review", "profile": "independent-review" },
    { "category": "bugfix", "capability": "debugging", "profile": "strong-reasoning" },
    { "category": "refactor", "capability": "implementation", "profile": "coding" },
    { "category": "docs", "capability": "documentation", "profile": "efficient" }
  ]
}